{
 "name": "BF-02 process fact register",
 "version": "1.8",
 "date": "2026-10-25",
 "source": "BF-02 process fact register v1.1 (Claude Docs, 16 Oct 2026); machine copy for the Burden & Fuel Optimiser",
 "statuses": [
  "Assumed",
  "Model",
  "Supported",
  "Validated",
  "Disputed",
  "Retired",
  "Measured",
  "Measured gap",
  "Calibration needed",
  "Plant choice",
  "Plant practice",
  "Plant data",
  "Modelled only",
  "Neutral"
 ],
 "grades": {
  "A": "BF-02 trial or clean step change",
  "B": "BF-02 regression or event study with a standard error",
  "C": "published value from other furnaces",
  "D": "vendor note or judgement"
 },
 "revision_log": [
  {
   "version": "1.8",
   "date": "2026-10-25",
   "change": "STRATA 1.5: blast moisture from the Open-Meteo daily RH at Wardha (DATA-11 restated, DATA-16 added: top-gas H2 validation); moisture data term removed (GAS-19 retired); GAS-14, 20, 22, 23, 25, 26, ASM-18, DATA-04, 06, 15 re-estimated / restated on the STRATA 1.5 posterior and the Open-Meteo basis. MOD / VAL regenerated. 25 Oct 2026 (same version): plans and the Blend Mix Optimiser take the plan day's Open-Meteo moisture (fetched live); shipped calibration re-solved at its window's Open-Meteo mean (18.45 g/Nm3); MOD facts regenerated at the calibration point (DATA-04, DATA-11)."
  },
  {
   "version": "1.7",
   "date": "2026-10-23",
   "change": "STRATA 1.4: production channel removed (GAS-16 retired) after the strict 2023-24 test; GAS-14, 19, 20, 22, 23 and ASM-18 re-estimated / restated on the STRATA 1.4 posterior; added GAS-25 (strict out-of-sample test on 413 days of 2023-24), GAS-26 (per-ore credit test, Measured gap), DATA-15 (2023-24 data set). MOD / VAL regenerated."
  },
  {
   "version": "1.6",
   "date": "2026-10-23",
   "change": "STRATA 1.3: network solves in the optimiser (no surrogate); RI / RDI from the laboratory report (GAS-21, DATA-13); ore and pellet RDI as shaft fines; two oversize materials (GAS-24); nut-coke term (GAS-23); blast moisture from the smoothed RH (DATA-11, no steps; GAS-19 re-estimated); PCI and nut-coke defaults from the regime (ASM-08); GAS-13, 14, 15, 16, 18, 20, ASM-18 updated; MOD / VAL regenerated. Also: ASM-20 (slag sale credit), DATA-14 (plant prices 23 Oct 2026, fuels from the cost sheet), slag price 457.85 Rs/t; sinter RI / RDI from the latest raw-material strength data."
  },
  {
   "version": "1.5",
   "date": "2026-10-22",
   "change": "STRATA 1.2 (rename of the gas-flow / shaft-efficiency model, formerly OMEGA): groups MOD (coke responses of Fixed-omega and STRATA-omega, generated by utils.burden_engine.model_facts) and VAL (out-of-sample burnt coke by blend family) added; GAS-13, 14, 15, 16, 18, 20, ASM-01, ASM-18 updated (RI set S8, production channel split, Investigate tier); GAS-21 (RI assumptions), GAS-22 (production against efficiency), DATA-12 (heat-loss coverage) added; statuses Modelled only and Neutral added."
  },
  {
   "version": "1.4",
   "date": "2026-10-21",
   "change": "OMEGA v1.1 after the out-of-sample test: GAS-14, GAS-15 replaced (per-group scales, AR(1) posterior on daily changes); GAS-17 retired (gas-capacity channel); GAS-19 (blast moisture), GAS-20 (out-of-sample test), FLOW-15, FLOW-16 (within-period resistance and stave heat load by material), DATA-11 (weather-record blast moisture) added; GAS-13, ASM-18, DATA-04, FLOW-02 notes updated."
  },
  {
   "version": "1.3",
   "date": "2026-10-21",
   "change": "Blend-dependent shaft efficiency (#262): GAS-13..18, ASM-18, ASM-19 added; GAS-06 and GAS-10 notes updated. No existing value changed."
  },
  {
   "version": "1.2",
   "date": "2026-10-19",
   "change": "Machine copy shipped with the Burden & Fuel Optimiser (#251). BAND-01: lower end implemented as a validity check, not an optimisation row (fact v1.1). No fact value changed."
  },
  {
   "version": "1.1",
   "date": "2026-10-16",
   "change": "Engine 2.0: RAFT from the plant workbook at the input blast moisture (DATA-03/04); BAND-01..03 enforced in code; webapp hand coefficients removed (COKE-17); COKE-14 no longer reports the ideal shaft. No fact value changed."
  },
  {
   "version": "1.0",
   "date": "2026-10-16",
   "change": "Register created: 17 COKE, 11 GAS, 14 FLOW, 10 DATA, 3 BAND and 13 ASM facts. Retired COKE-17 and DATA-10."
  }
 ],
 "facts": [
  {
   "id": "COKE-01",
   "group": "COKE",
   "statement": "PCI +10 kg/tHM -> coke",
   "value": -8.7,
   "unit": "kg/tHM",
   "status": "Model",
   "grade": "C",
   "basis": "Two-zone Rist balance, shaft efficiency 0.80, T_R 950 degC, Jul-Oct 2026 calibration",
   "literature": "Replacement ratio 0.7-0.9, falling above ~180 kg/tHM; Geerdes -9",
   "next_test": "T3",
   "version": "1.0",
   "date": "2026-10-16",
   "range": [
    -9.9,
    -8.7
   ],
   "note": "Replacement ratio 0.87 (fixed eta CO gives 0.99)"
  },
  {
   "id": "COKE-02",
   "group": "COKE",
   "statement": "Nut coke +10 kg/tHM -> coke",
   "value": -9.9,
   "unit": "kg/tHM",
   "status": "Model",
   "grade": "C",
   "basis": "Two-zone Rist balance, shaft efficiency 0.80, T_R 950 degC, Jul-Oct 2026 calibration",
   "literature": "Ratio 0.59-1.0, site-specific",
   "next_test": "T2",
   "version": "1.0",
   "date": "2026-10-16",
   "note": "Replacement ratio 0.99"
  },
  {
   "id": "COKE-03",
   "group": "COKE",
   "statement": "HM Si +0.1 % -> coke",
   "value": 2.15,
   "unit": "kg/tHM",
   "status": "Model",
   "grade": "C",
   "basis": "Two-zone Rist balance, shaft efficiency 0.80, T_R 950 degC, Jul-Oct 2026 calibration",
   "literature": "Geerdes +4 (includes the hotter hearth that comes with high Si)",
   "next_test": "Q5, T8",
   "version": "1.0",
   "date": "2026-10-16",
   "range": [
    1.52,
    2.18
   ],
   "note": "Disagrees with literature"
  },
  {
   "id": "COKE-04",
   "group": "COKE",
   "statement": "HMT +10 degC -> coke",
   "value": 1.0,
   "unit": "kg/tHM",
   "status": "Model",
   "grade": "C",
   "basis": "Two-zone Rist balance, shaft efficiency 0.80, T_R 950 degC, Jul-Oct 2026 calibration",
   "literature": "No published value; heat content alone ~ +1.0",
   "next_test": "Q11",
   "version": "1.0",
   "date": "2026-10-16",
   "range": [
    0.59,
    0.99
   ]
  },
  {
   "id": "COKE-05",
   "group": "COKE",
   "statement": "Hot blast temperature +50 degC -> coke",
   "value": -6.7,
   "unit": "kg/tHM",
   "status": "Model",
   "grade": "C",
   "basis": "Two-zone Rist balance, shaft efficiency 0.80, T_R 950 degC, Jul-Oct 2026 calibration",
   "literature": "Geerdes -9 per 100 degC (-5.7 per 50 degC scaled)",
   "next_test": "Q1, T1",
   "version": "1.0",
   "date": "2026-10-16",
   "range": [
    -6.9,
    -4.1
   ]
  },
  {
   "id": "COKE-06",
   "group": "COKE",
   "statement": "Blast moisture +5 g/Nm3 -> coke",
   "value": 4.0,
   "unit": "kg/tHM",
   "status": "Model",
   "grade": "C",
   "basis": "Two-zone Rist balance, shaft efficiency 0.80, T_R 950 degC, Jul-Oct 2026 calibration",
   "literature": "Geerdes +6 per 10 g (+3.8 per 5 g scaled)",
   "next_test": "Q8",
   "version": "1.0",
   "date": "2026-10-16",
   "range": [
    2.2,
    4.1
   ]
  },
  {
   "id": "COKE-07",
   "group": "COKE",
   "statement": "O2 +1 pt of hot blast (tag +0.84) at fixed production -> coke",
   "value": 0.5,
   "unit": "kg/tHM",
   "status": "Model",
   "grade": "C",
   "basis": "Two-zone Rist balance, shaft efficiency 0.80, T_R 950 degC, Jul-Oct 2026 calibration",
   "literature": "Geerdes +1 (row to be checked in print)",
   "next_test": "",
   "version": "1.0",
   "date": "2026-10-16",
   "range": [
    0.3,
    2.1
   ]
  },
  {
   "id": "COKE-08",
   "group": "COKE",
   "statement": "Production +5 % (heat loss fixed per hour) -> coke",
   "value": -1.8,
   "unit": "kg/tHM",
   "status": "Model",
   "grade": "C",
   "basis": "Two-zone Rist balance, shaft efficiency 0.80, T_R 950 degC, Jul-Oct 2026 calibration",
   "literature": "Losses ~0.05 kg coke per MJ/tHM; BF-02 0.076",
   "next_test": "Q11",
   "version": "1.0",
   "date": "2026-10-16",
   "range": [
    -1.9,
    -1.6
   ]
  },
  {
   "id": "COKE-09",
   "group": "COKE",
   "statement": "Slag +100 kg/tHM -> coke",
   "value": 6.1,
   "unit": "kg/tHM",
   "status": "Model",
   "grade": "C",
   "basis": "Two-zone Rist balance, shaft efficiency 0.80, T_R 950 degC, Jul-Oct 2026 calibration (fixed eta CO +7.8)",
   "literature": "5-15 (Geerdes 5; value-in-use tables 15)",
   "next_test": "Q4",
   "version": "1.0",
   "date": "2026-10-16",
   "range": [
    5.0,
    15.0
   ]
  },
  {
   "id": "COKE-10",
   "group": "COKE",
   "statement": "Coke ash +1 % -> coke",
   "value": 3.8,
   "unit": "kg/tHM",
   "status": "Model",
   "grade": "C",
   "basis": "Two-zone Rist balance, shaft efficiency 0.80, T_R 950 degC, Jul-Oct 2026 calibration; slag +3.2 kg/tHM",
   "literature": "+6 kg, or 1-1.5 % of coke rate",
   "next_test": "supplier campaigns",
   "version": "1.0",
   "date": "2026-10-16"
  },
  {
   "id": "COKE-11",
   "group": "COKE",
   "statement": "Raw limestone in the burden +10 kg/tHM -> coke",
   "value": 1.9,
   "unit": "kg/tHM",
   "status": "Model",
   "grade": "C",
   "basis": "Two-zone Rist balance, shaft efficiency 0.80, T_R 950 degC, Jul-Oct 2026 calibration; 0-100 % of its CO2 below the reserve zone (ASM-04)",
   "literature": "+2.0 to +3.5 (20-35 kg per 100 kg flux removed)",
   "next_test": "Q7, T7",
   "version": "1.0",
   "date": "2026-10-16",
   "range": [
    0.4,
    3.4
   ]
  },
  {
   "id": "COKE-12",
   "group": "COKE",
   "statement": "Quartzite +10 kg/tHM -> coke",
   "value": 0.6,
   "unit": "kg/tHM",
   "status": "Model",
   "grade": "C",
   "basis": "Two-zone Rist balance, shaft efficiency 0.80, T_R 950 degC, Jul-Oct 2026 calibration (slag heat)",
   "literature": "",
   "next_test": "",
   "version": "1.0",
   "date": "2026-10-16"
  },
  {
   "id": "COKE-13",
   "group": "COKE",
   "statement": "Lower-zone heat loss +5 GJ/h -> coke",
   "value": 4.1,
   "unit": "kg/tHM",
   "status": "Model",